{
  "schemaVersion": 1,
  "id": "ocarina-of-time",
  "kind": "game",
  "catalog": {
    "game": "catalog/game.json",
    "cards": "catalog/cards.json",
    "vocabulary": "catalog/vocabulary.json"
  },
  "assets": "assets",
  "pipelines": "pipelines",
  "adapters": [
    {
      "id": "shipwright",
      "runtime": "o2r-code-mod",
      "source": "adapters/shipwright/plugin"
    }
  ]
}
